{
  "name": "CHIPS",
  "kind": "pbaas",
  "datadir_hash": "f315367528394674d45277e369629605a1c3ce9f",
  "ports": {
    "p2p": 22777,
    "rpc": 22778
  },
  "bootstrap": {
    "url": "https://bootstrap.verus.expert/f315367528394674d45277e369629605a1c3ce9f-bootstrap/f315367528394674d45277e369629605a1c3ce9f-bootstrap.tar.gz",
    "signer": "Oink bootstrap releases@",
    "approximate_size_bytes": 10018999028
  },
  "notes": "Community PBaaS chain. Requires a reachable VRSC root node. Bootstraps come from bootstrap.verus.expert, which publishes a sha256sum over valid TLS. Observed memory use in production is ~6 GB observed at the chain tip."
}
